difficoltà,domanda,risposta,row_id,result,Usage
Hard,"Quali sono i piatti che necessitano di una licenza di grado 3 o superiore per la preparazione e sono serviti in un ristorante che si trova entro un raggio di 659 anni luce dal pianeta Namecc, Namecc incluso?","Sinfonia Temporale di Fenice e Xenodonte su Pane degli Abissi con Colata di Plasma Vitale e Polvere di Crononite, Sinfonia Galattica ai Cristalli di Nebulite, Stella Nova, Il Viaggio delle Dimensioni Confluenti, Portale del Cosmo: Sinfonia di Sapori Multidimensionali, Sinfonia di Multiverso: La Danza degli Elementi, Nebulosa Celestiale di Sogni Quantici",89,"246,232,267,104,171,264,128",Private
Hard,"Quali sono i piatti che necessitano almeno della licenza Psionica di grado 4 e che sono stati preparati in ristoranti entro un raggio di 176 anni luce dal pianeta Arrakis, Arrakis incluso?","Cosmic Serenade, Fusione Celeste, Universo in Fusilli - Variazione Celestiale, Sinfonia Cosmica di Andromeda",90,"13,51,275,209",Public
Hard,"Quali piatti sono stati creati utilizzando almeno una tecnica di surgelamento secondo il Manuale di Cucina di Sirius Cosmo e sono stati serviti in un ristorante situato entro un raggio di 317 anni luce dal pianeta Krypton, Krypton incluso?","Sinfonia Galattica Agentica, Sinfonia Astrale - Risotto Multiversale con Risacca Celeste, Il Viaggio Cosmico di Marinetti, Fenice sull'Orizzonte degli Eventi, Risotto Cosmico alla Draconia",91,"231,197,102,50,182",Private
Hard,"Quali piatti speciali sono stati creati utilizzando le tecniche di impasto del Manuale di Cucina di Sirius Cosmo e sono serviti nei ristoranti vicini al pianeta Krypton, entro un raggio di 21 anni luce, Krypton incluso?","Sinfonia Celeste di Granuli Arcobaleno e Riso di Cassandra, Galassia di Sapore, Sinfonia Galattica Agentica, Il Viaggio Cosmico di Marinetti, Nebulosa di Dragone all'Essenza di Vuoto, Piastrella Celestiale di Gnocchi del Crepuscolo con Nebulosa di Riso di Cassandra, Lacrime di Unicorno e Velo di Materia Oscura",92,"199,68,231,102,134,148",Public
Hard,"Quali sono i piatti disponibili nei ristoranti entro 126 anni luce da Cybertron, quest'ultimo incluso, che non includono Funghi dell'Etere?","Sfogliare Galattico di Sogni Temporali, Sinfonia Temporale nello Spaghi del Sole, Cosmopolis delle Galassie Perdute, Sinfonia di Crepuscolo Celestiale, Galassia Risvegliata, Viaggio dei Sensi: Bolla Temporale di Aromi Ancestrali, Sinfonia Tempolare Galattica, Sinfonia Temporale al Tocco di Crono, Sinfonia di Stagioni Stellari",93,"193,247,20,259,59,286,241,243,265",Private
Hard,"Quali piatti possiamo gustare in un ristorante entro 83 anni luce da Cybertron, quest'ultimo incluso, evitando rigorosamente quelli cucinati con Farina di Nettuno?","Sfogliare Galattico di Sogni Temporali, Sinfonia Temporale nello Spaghi del Sole, Nebulosa di Fenice con Sinfonia Eterea, Galassia Risvegliata, Viaggio dei Sensi: Bolla Temporale di Aromi Ancestrali, Sinfonia Tempolare Galattica, Sinfonia Temporale al Tocco di Crono, Sinfonia di Stagioni Stellari",94,"193,247,135,59,286,241,243,265",Public
Impossible,Quali piatti posso mangiare se faccio parte dell'Ordine degli Armonisti?,"Il Simposio degli Infiniti Ricordi, Pizza Cri",95,"100,157",Private
Impossible,Quali piatti posso mangiare se faccio parte dell'Ordine della Galassia di Andromeda?,"Sinfonia Celestiale dei Ricordi, Pizza Fra",96,"201,159",Public
Impossible,"Che piatti posso mangiare che contegnano Essenza di Tachioni, sia stata usata la Cottura a Vapore Ecodinamico Bilanciato nella preparazione ma anche che ogni singolo ingrediente non superi le quantità legali prescritte dal Codice di Galattico?","Galassia di Sapore Quantum, Portale Cosmico: Sinfonia di Gnocchi del Crepuscolo con Essenza di Tachioni e Sfumature di Fenice, Sinfonia Cosmica all'Alba di Fenice, Sinfonia Temporale al Tocco di Crono, Sinfonia di Cristalli e Rigenerazione",97,"72,169,205,243,260",Private
Impossible,Che piatti che contengono sia Petali di Eco che Foglie di Mandragora posso mangiare se voglio che nessun ingrediente superi le quantità legali prescritte dal Codice di Galattico?,"Cosmic Harmony, La Balena incontra la Mandragora, Nebulosa di Confini Sfondati, Pioggia Calante dell'Universo, Sinfonia Cosmica di Andromeda, Sinfonia di Galassie Riflesse",98,"9,113,132,150,209,262",Public
Impossible,Che piatti posso mangiare che contengano i Fusilli del Vento ma che abbia nella sua preparazione la Marinatura a Infusione Gravitazionale correttamente operata da un chef che ha le corrette licenze e certificazioni descritte dal Codice di Galattico?,"Sfogliare Galattico di Sogni Temporali, Sinfonia Interstellare di Fusilli del Vento con Nettare di Sirena",99,"193,235",Private
Impossible,Che piatti posso mangiare che contengano Teste di Idra ma che abbia nella sua preparazione la Marinatura a Infusione Gravitazionale correttamente operata da un chef che ha le corrette licenze e certificazioni descritte dal Codice di Galattico?,"Galassie in Epifania: Risotto Celestiale con Preziosi dell'Universo, Porta Celestiale alle Stelle, Sinfonia Interstellare di Fusilli del Vento con Nettare di Sirena",100,"89,166,235",Public
